{
  "$schema": "https://json-schema.org/draft/2020-12/schema",
  "$id": "https://vigil.local/schemas/finding-record.schema.json",
  "$comment": "Generated by orchestrator/backend/scripts/generate_agent_schemas.py from app.api.assessment.FindingRecordRequest plus agent-side overlays where the CLI contract is intentionally stricter than the backend model.",
  "additionalProperties": false,
  "properties": {
    "slug": {
      "maxLength": 256,
      "type": "string",
      "default": null,
      "title": "Slug",
      "minLength": 1,
      "description": "Stable kebab-case identifier for this finding (e.g. 'sqli-search-q'). Omit to auto-generate."
    },
    "title": {
      "maxLength": 512,
      "minLength": 1,
      "title": "Title",
      "type": "string",
      "description": "One-line finding name: vuln class + location (e.g. 'Blind SQL injection in /search?q')."
    },
    "severity": {
      "default": "info",
      "maxLength": 32,
      "minLength": 1,
      "title": "Severity",
      "type": "string",
      "description": "CVSS-aligned impact rating. Use 'critical' only for CVSS >=9.0 or trivially exploitable RCE/auth-bypass.",
      "enum": [
        "info",
        "low",
        "medium",
        "high",
        "critical"
      ]
    },
    "workflow_status": {
      "default": "active",
      "maxLength": 32,
      "minLength": 1,
      "title": "Workflow Status",
      "type": "string",
      "description": "Lifecycle state. New findings: 'active'. Post-exploitation confirmed: 'exploited'. WAF/control stopped testing: 'blocked'. Duplicate absorbed into another record: 'merged'. Delivered to client: 'reported'.",
      "enum": [
        "draft",
        "active",
        "exploited",
        "blocked",
        "false_positive",
        "merged",
        "reported"
      ]
    },
    "verification_state": {
      "default": "unreviewed",
      "maxLength": 32,
      "minLength": 1,
      "title": "Verification State",
      "type": "string",
      "description": "Human review state. Leave 'unreviewed' when first recording; set 'verified' after confirming exploitability; 'disputed' when contested.",
      "enum": [
        "unreviewed",
        "verified",
        "disputed"
      ]
    },
    "verification_disposition": {
      "default": "none",
      "maxLength": 32,
      "minLength": 1,
      "title": "Verification Disposition",
      "type": "string",
      "description": "Verifier outcome. 'none': not yet checked. 'pending_runtime_proof': needs live PoC. 'confirmed': exploitability proven. 'downgraded': real but severity reduced. 'false_positive': not exploitable.",
      "enum": [
        "none",
        "pending_runtime_proof",
        "confirmed",
        "downgraded",
        "false_positive"
      ]
    },
    "defect_family": {
      "default": "",
      "maxLength": 128,
      "title": "Defect Family",
      "type": "string",
      "description": "Short vuln-class label for grouping (e.g. 'sql-injection', 'buffer-overflow', 'ssrf'). Use kebab-case."
    },
    "root_cause_key": {
      "default": "",
      "maxLength": 256,
      "title": "Root Cause Key",
      "type": "string",
      "description": "Stable key linking variants to a shared root cause (e.g. 'missing-input-sanitization-search'). Omit if not part of a variant cluster."
    },
    "auth_context": {
      "default": "anonymous",
      "maxLength": 128,
      "minLength": 1,
      "title": "Auth Context",
      "type": "string",
      "description": "Authentication state when the finding was triggered. Use 'anonymous', a role name (e.g. 'user', 'admin'), or credential slug."
    },
    "canonical_location": {
      "default": "",
      "maxLength": 1024,
      "title": "Canonical Location",
      "type": "string",
      "description": "Primary affected location. URL for network findings (e.g. 'https://target.example/search?q'); 'file:path:line' for code findings."
    },
    "summary": {
      "default": "",
      "maxLength": 4096,
      "title": "Summary",
      "type": "string",
      "description": "2-5 sentence description: what is vulnerable, how it is triggered, and the attacker impact."
    },
    "evidence_ref": {
      "default": "",
      "maxLength": 1024,
      "title": "Evidence Ref",
      "type": "string",
      "description": "Path or identifier for supporting artifact (e.g. 'scans/sqlmap.txt', 'artifacts/burp-export.xml'). Leave empty if evidence is inline in details.evidence."
    },
    "notes": {
      "default": "",
      "maxLength": 20000,
      "title": "Notes",
      "type": "string",
      "description": "Freeform operational notes: retesting observations, partial progress, raw tool output. Not shown in reports."
    },
    "source_name": {
      "default": "",
      "maxLength": 128,
      "title": "Source Name",
      "type": "string",
      "description": "Agent or tool that produced this record (e.g. 'vulnerability-analyst', 'nuclei'). Mirrors provenance.agent_name for quick filtering."
    },
    "details": {
      "additionalProperties": false,
      "title": "Details",
      "type": "object",
      "required": [
        "evidence",
        "impact"
      ],
      "properties": {
        "discovered_by": {
          "type": "string",
          "description": "Agent name that first identified this finding (e.g. 'vulnerability-analyst')."
        },
        "owasp_category": {
          "type": "string",
          "description": "OWASP Top 10 2021 category code and name (e.g. 'A03:2021 Injection')."
        },
        "cwe_id": {
          "type": "string",
          "description": "CWE identifier (e.g. 'CWE-89' for SQL injection, 'CWE-122' for heap buffer overflow)."
        },
        "parameter": {
          "type": "string",
          "description": "Exact name of the affected input: query param, header, JSON key, or form field (e.g. 'q', 'X-User-Id', 'username')."
        },
        "slot_type": {
          "type": "string",
          "description": "Code-analysis input class for the attack (e.g. 'URL-COMPONENT', 'NETWORK-INPUT', 'PROTOCOL-FIELD')."
        },
        "request_method": {
          "type": "string",
          "description": "HTTP verb that triggers the finding (e.g. 'GET', 'POST', 'PUT', 'DELETE')."
        },
        "evidence": {
          "type": "string",
          "minLength": 1,
          "description": "Verbatim proof: exact response excerpt, artifact path, or replayable request/response. Must be sufficient to reproduce independently."
        },
        "kill_reason": {
          "type": "string",
          "description": "Verifier rationale for false_positive verdict: which check failed and why the issue is not exploitable."
        },
        "kill_check": {
          "type": "integer",
          "minimum": 1,
          "maximum": 5,
          "description": "Verification check number (1-5) that produced the false-positive verdict."
        },
        "entry_point": {
          "type": "string",
          "description": "Where attacker-controlled data enters the program (e.g. 'curl_url_set(CURLURLPART_URL, attacker_url)', 'POST /upload body field filename')."
        },
        "sink": {
          "type": "string",
          "description": "Dangerous operation that consumes tainted data (e.g. 'memcpy(buf, scheme, schemelen) at lib/urlapi.c:342', 'sqlite3_exec(db, query)')."
        },
        "taint_path": {
          "type": "string",
          "description": "Arrow-delimited data flow from entry_point to sink (e.g. 'curl_url_set -> parseurl() -> memcpy(buf, scheme, schemelen)')."
        },
        "guards_evaluated": {
          "type": "string",
          "description": "List each relevant bounds/validation check and state whether it is absent, bypassable, or ineffective (e.g. 'No bounds check on schemelen before memcpy')."
        },
        "impact": {
          "type": "string",
          "minLength": 1,
          "description": "Concrete attacker outcome: what data is exposed or what action can be taken, and who is affected (e.g. 'Anonymous attacker can read all DB rows', 'Remote code execution via heap corruption')."
        },
        "cvss_vector": {
          "type": "string",
          "minLength": 1,
          "description": "CVSS 3.1 vector string (e.g. 'CVSS:3.1/AV:N/AC:L/PR:N/UI:N/S:U/C:H/I:H/A:N')."
        },
        "cvss_score": {
          "type": "number",
          "exclusiveMinimum": 0,
          "maximum": 10,
          "description": "CVSS 3.1 base score (0.1-10.0). Must match cvss_vector."
        },
        "remediation": {
          "type": "string",
          "description": "Specific fix or missing control (e.g. 'Use parameterized queries', 'Add bounds check on schemelen before memcpy')."
        },
        "steps_to_reproduce": {
          "type": "array",
          "items": {
            "type": "string"
          },
          "description": "Ordered reproduction steps, one action per string. Start from initial access state; end at impact observation."
        },
        "poc_code": {
          "type": "string",
          "description": "Minimal exploit code or script that reproduces the finding. Omit if poc_request/poc_response is sufficient."
        },
        "poc_request": {
          "type": "object",
          "description": "HTTP request that triggers the vulnerability.",
          "properties": {
            "method": {
              "type": "string"
            },
            "url": {
              "type": "string"
            },
            "headers": {
              "type": "object",
              "additionalProperties": {
                "type": "string"
              }
            },
            "body": {
              "type": "string"
            }
          }
        },
        "poc_response": {
          "type": "object",
          "description": "Observed HTTP response that confirms the vulnerability.",
          "properties": {
            "status": {
              "type": "integer"
            },
            "headers": {
              "type": "object",
              "additionalProperties": {
                "type": "string"
              }
            },
            "body_excerpt": {
              "type": "string"
            }
          }
        },
        "references": {
          "type": "array",
          "items": {
            "type": "string"
          },
          "description": "CVE IDs, NVD/advisory URLs, or CWE links relevant to this finding."
        },
        "chain_required": {
          "type": "boolean",
          "description": "Set true only when this finding has no standalone impact and is meaningful only as part of an exploit chain."
        },
        "chain_rationale": {
          "type": "string",
          "description": "Required when chain_required is true: explain which chain step this enables and why standalone impact is insufficient."
        },
        "required_followup": {
          "type": "array",
          "items": {
            "type": "string"
          },
          "description": "Concrete next steps needed to validate or complete the chain (e.g. 'Confirm reachable network caller for the URL parser')."
        },
        "variant_of": {
          "type": "string",
          "description": "Slug of the root finding when this record is a verified same-class variant (e.g. 'sqli-search-q')."
        },
        "original_pattern": {
          "type": "string",
          "description": "Abstract pattern signature copied verbatim from the root finding during variant analysis."
        }
      }
    },
    "provenance": {
      "additionalProperties": false,
      "title": "Provenance",
      "type": "object",
      "properties": {
        "agent_name": {
          "type": "string",
          "description": "Agent that produced this finding (e.g. 'vulnerability-analyst'). Mirror of source_name."
        },
        "artifact": {
          "type": "string",
          "description": "Path or ID of the artifact this finding was derived from."
        }
      }
    },
    "evidence_type": {
      "enum": [
        "network-confirmed",
        "code-inferred",
        "theoretical",
        "informational"
      ],
      "type": [
        "string",
        "null"
      ],
      "default": null,
      "title": "Evidence Type",
      "description": "Strength of evidence. 'network-confirmed': live exploit or observed response. 'code-inferred': static/dataflow analysis without runtime proof. 'theoretical': logic-based hypothesis, no code or traffic evidence. 'informational': non-exploitable observation."
    },
    "request_variant_id": {
      "type": "integer",
      "default": null,
      "title": "Request Variant Id",
      "minimum": 1
    },
    "service_id": {
      "type": "integer",
      "default": null,
      "title": "Service Id",
      "minimum": 1
    },
    "surface_id": {
      "type": "integer",
      "default": null,
      "title": "Surface Id",
      "minimum": 1
    },
    "links": {
      "items": {
        "properties": {
          "link_kind": {
            "default": "related",
            "maxLength": 64,
            "minLength": 1,
            "title": "Link Kind",
            "type": "string",
            "description": "Relationship type (e.g. 'related', 'exploits', 'chained-with', 'variant-of')."
          },
          "target_kind": {
            "maxLength": 64,
            "minLength": 1,
            "title": "Target Kind",
            "type": "string",
            "description": "Entity type of the link target (e.g. 'finding', 'credential', 'access_record', 'attack_chain')."
          },
          "target_id": {
            "type": "integer",
            "default": null,
            "title": "Target Id",
            "minimum": 1,
            "description": "Database ID of the target entity. Provide target_id OR target_ref, not both."
          },
          "target_ref": {
            "default": "",
            "maxLength": 1024,
            "title": "Target Ref",
            "type": "string",
            "description": "Slug or string reference for the target when target_id is unavailable."
          },
          "notes": {
            "default": "",
            "maxLength": 4096,
            "title": "Notes",
            "type": "string",
            "description": "Why this link exists or how the two entities are related."
          },
          "provenance": {
            "additionalProperties": false,
            "title": "Provenance",
            "type": "object",
            "properties": {
              "agent_name": {
                "type": "string"
              }
            }
          }
        },
        "required": [
          "target_kind"
        ],
        "title": "FindingLinkRequest",
        "type": "object",
        "additionalProperties": false
      },
      "title": "Links",
      "type": "array"
    }
  },
  "required": [
    "title",
    "severity",
    "workflow_status",
    "verification_state",
    "verification_disposition",
    "defect_family",
    "root_cause_key",
    "auth_context",
    "canonical_location",
    "summary",
    "evidence_ref",
    "notes",
    "details"
  ],
  "title": "Assessment Finding Record",
  "type": "object",
  "examples": [
    {
      "title": "Blind SQL injection in search",
      "severity": "high",
      "defect_family": "sql-injection",
      "canonical_location": "https://target.example/search?q",
      "summary": "Boolean-blind SQL injection on the search endpoint",
      "evidence_ref": "scans/sqlmap.txt",
      "notes": "curl 'https://target.example/search?q=test%27+AND+1%3D1--+-' -> 200 with results",
      "details": {
        "owasp_category": "A03:2021 Injection",
        "cwe_id": "CWE-89",
        "request_method": "GET",
        "parameter": "q",
        "evidence": "Replayable request/response pair in scans/sqlmap.txt",
        "impact": "Anonymous attackers can extract arbitrary data from the backing store",
        "cvss_vector": "CVSS:3.1/AV:N/AC:L/PR:N/UI:N/S:U/C:H/I:N/A:N",
        "cvss_score": 7.5,
        "remediation": "Use parameterized queries for all search input",
        "steps_to_reproduce": [
          "Send GET /search?q=test'+AND+1=1--+-",
          "Observe normal search results returned"
        ],
        "poc_request": {
          "method": "GET",
          "url": "https://target.example/search?q=test'+AND+1=1--+-",
          "headers": {
            "Accept": "text/html"
          },
          "body": ""
        },
        "poc_response": {
          "status": 200,
          "headers": {
            "Content-Type": "text/html"
          },
          "body_excerpt": "<div class='results'>3 items found</div>"
        },
        "chain_required": false,
        "references": [
          "https://cwe.mitre.org/data/definitions/89.html"
        ],
        "discovered_by": "vulnerability-analyst"
      },
      "workflow_status": "active",
      "verification_state": "unreviewed",
      "verification_disposition": "none",
      "root_cause_key": "",
      "auth_context": "anonymous",
      "source_name": "vulnerability-analyst",
      "provenance": {
        "agent_name": "vulnerability-analyst"
      },
      "links": []
    },
    {
      "title": "Heap buffer overflow in URL parser via overlong scheme",
      "severity": "high",
      "defect_family": "buffer-overflow",
      "canonical_location": "file:lib/urlapi.c:342",
      "summary": "Attacker-controlled URL scheme exceeding 64 bytes overflows heap buffer in parseurl()",
      "details": {
        "cwe_id": "CWE-122",
        "impact": "Remote code execution via heap corruption",
        "evidence": "memcpy(buf, scheme, schemelen) copies attacker-controlled bytes without a bounds check",
        "entry_point": "curl_url_set(CURLURLPART_URL, attacker_url)",
        "sink": "memcpy(buf, scheme, schemelen) at lib/urlapi.c:342",
        "taint_path": "curl_url_set(CURLURLPART_URL, attacker_url) -> parseurl() -> memcpy(buf, scheme, schemelen)",
        "guards_evaluated": "No bounds check on schemelen before memcpy",
        "slot_type": "URL-COMPONENT",
        "cvss_vector": "CVSS:3.1/AV:N/AC:H/PR:N/UI:N/S:U/C:H/I:H/A:H",
        "cvss_score": 8.1,
        "remediation": "Add bounds check on schemelen before memcpy; reject URLs with scheme longer than 63 bytes",
        "steps_to_reproduce": [
          "Craft URL with scheme > 64 bytes",
          "Pass to curl_url_set",
          "Observe heap corruption under ASAN"
        ],
        "chain_required": true,
        "chain_rationale": "The primitive is meaningful for exploitation, but final report impact depends on chaining it to a reachable crash or controlled allocation path.",
        "required_followup": [
          "Exercise the URL parser through a network-reachable caller",
          "Confirm whether the overflow produces controlled corruption under sanitizer instrumentation"
        ],
        "references": [
          "https://cwe.mitre.org/data/definitions/122.html"
        ],
        "discovered_by": "vulnerability-analyst"
      },
      "workflow_status": "active",
      "verification_state": "unreviewed",
      "verification_disposition": "none",
      "root_cause_key": "",
      "auth_context": "anonymous",
      "evidence_ref": "",
      "notes": "",
      "source_name": "vulnerability-analyst",
      "provenance": {
        "agent_name": "vulnerability-analyst"
      },
      "links": []
    }
  ]
}
